{
  "schemaVersion": 1,
  "id": "closed-anonymous-record-lowering-snapshot",
  "role": "fixture",
  "type": "snapshot",
  "status": "active",
  "requirements": [
    "HXC-SEM-004",
    "HXC-SEM-009"
  ],
  "sources": [
    "scripts/test/snapshots.py",
    "test/aggregate_lowering/expected/aggregates.hxcir",
    "test/aggregate_lowering/expected/program.h",
    "test/aggregate_lowering/expected/program.c",
    "test/aggregate_lowering/expected/aggregates.json",
    "test/aggregate_lowering/expected/symbols.json",
    "test/aggregate_lowering/run.py"
  ],
  "runner": {
    "command": [
      "python3",
      "../../../scripts/test/snapshots.py",
      "--check",
      "--suite",
      "aggregate-lowering"
    ],
    "workingDirectory": "test/snapshot/aggregate-lowering",
    "timeoutSeconds": 120,
    "network": false
  },
  "expected": {
    "exitCode": 0,
    "artifacts": [
      {
        "path": "test/aggregate_lowering/expected/aggregates.hxcir",
        "format": "hxcir",
        "comparison": "exact"
      },
      {
        "path": "test/aggregate_lowering/expected/program.h",
        "format": "header",
        "comparison": "exact"
      },
      {
        "path": "test/aggregate_lowering/expected/program.c",
        "format": "c",
        "comparison": "exact"
      },
      {
        "path": "test/aggregate_lowering/expected/aggregates.json",
        "format": "json",
        "comparison": "semantic-json"
      },
      {
        "path": "test/aggregate_lowering/expected/symbols.json",
        "format": "json",
        "comparison": "semantic-json"
      }
    ]
  }
}
