{
  "schemaVersion": 1,
  "id": "bytes-runtime",
  "role": "fixture",
  "type": "differential",
  "status": "active",
  "requirements": [
    "HXC-PROD-002",
    "HXC-SEM-008",
    "HXC-RT-008",
    "HXC-RT-009"
  ],
  "sources": [
    "docs/bytes-runtime.md",
    "runtime/hxrt/include/hxrt/bytes.h",
    "runtime/hxrt/include/hxrt/bytes_string.h",
    "runtime/hxrt/include/hxrt/string.h",
    "runtime/hxrt/include/hxrt/string_scalar.h",
    "runtime/hxrt/src/bytes.c",
    "runtime/hxrt/src/bytes_string.c",
    "runtime/hxrt/src/string.c",
    "runtime/hxrt/src/string_scalar.c",
    "std/c/CStringBufferRef.hx",
    "std/c/_std/haxe/io/Bytes.hx",
    "test/differential/bytes-runtime/bytes_runtime.c",
    "test/differential/bytes-runtime/generated/Main.hx",
    "test/differential/bytes-runtime/generated/oracle.hxml",
    "test/differential/bytes-runtime/native/include/mutable_text.h",
    "test/differential/bytes-runtime/native/mutable_text.c",
    "test/differential/bytes-runtime/native_buffer/Main.hx",
    "test/differential/bytes-runtime/native_buffer/MutableTextApi.hx",
    "test/differential/bytes-runtime/negative/buffer_escape/Main.hx",
    "test/differential/bytes-runtime/negative/buffer_missing_intrinsic/Main.hx",
    "test/differential/bytes-runtime/negative/buffer_missing_intrinsic/MutableTextApi.hx",
    "test/differential/bytes-runtime/negative/buffer_parameter_mismatch/Main.hx",
    "test/differential/bytes-runtime/negative/buffer_parameter_mismatch/MutableTextApi.hx",
    "test/differential/bytes-runtime/negative/buffer_return/Main.hx",
    "test/differential/bytes-runtime/negative/buffer_return/MutableTextApi.hx",
    "test/differential/bytes-runtime/negative/buffer_temporary/Main.hx",
    "test/differential/bytes-runtime/negative/buffer_temporary/MutableTextApi.hx",
    "test/differential/bytes-runtime/negative/buffer_wrong_carrier/Main.hx",
    "test/differential/bytes-runtime/negative/buffer_wrong_carrier/MutableTextApi.hx",
    "test/differential/bytes-runtime/negative/return_escape/Main.hx",
    "test/differential/bytes-runtime/negative/runtime_string_operation/Main.hx",
    "test/differential/bytes-runtime/negative/raw_native_encoding/Main.hx",
    "test/differential/bytes-runtime/negative/unsupported_method/Main.hx",
    "test/differential/bytes-runtime/return_string/Main.hx",
    "test/differential/bytes-runtime/run.py"
  ],
  "runner": {
    "command": [
      "python3",
      "run.py"
    ],
    "workingDirectory": "test/differential/bytes-runtime",
    "timeoutSeconds": 240,
    "network": false
  },
  "expected": {
    "exitCode": 0,
    "stdout": {
      "mode": "regex",
      "value": "bytes-runtime: OK: .*Eval plus generated ordinary-Haxe Bytes; C11 O0/O2 and C\\+\\+17 header consumers, aliasing, overlap, bounds, checked UTF-8 snapshots, lowercase hexadecimal encoding, call-scoped mutable C text, allocation rollback, ownership, sanitizers, and selective symbols passed$"
    },
    "oracle": "test/differential/bytes-runtime/generated/oracle.hxml",
    "artifacts": [
      {
        "path": "runtime/hxrt/include/hxrt/bytes.h",
        "format": "header",
        "comparison": "layout"
      }
    ]
  }
}
