{
  "schemaVersion": 1,
  "id": "string-literal-output-positive",
  "role": "fixture",
  "type": "positive",
  "status": "active",
  "requirements": [
    "HXC-PROD-002",
    "HXC-SEM-006",
    "HXC-EX-001"
  ],
  "sources": [
    "src/reflaxe/c/lowering/CBodyLowering.hx",
    "src/reflaxe/c/lowering/CBodyEmitter.hx",
    "test/string_output/fixtures/positive/Main.hx",
    "test/string_output/fixtures/nonliteral/Main.hx",
    "test/string_output/run.py"
  ],
  "runner": {
    "command": [
      "python3",
      "../../string_output/run.py"
    ],
    "workingDirectory": "test/positive/string-output",
    "timeoutSeconds": 300,
    "network": false
  },
  "expected": {
    "exitCode": 0,
    "stdout": {
      "mode": "regex",
      "value": "string-output: OK:.*exact UTF-8/NUL output"
    },
    "artifacts": [
      {
        "path": "test/string_output/expected/output.hxcir",
        "format": "hxcir",
        "comparison": "exact"
      },
      {
        "path": "test/string_output/expected/program.c",
        "format": "c",
        "comparison": "exact"
      }
    ]
  }
}
