{
  "schemaVersion": 1,
  "id": "haxe-enum-lowering-native",
  "role": "fixture",
  "type": "runtime",
  "status": "active",
  "requirements": [
    "HXC-SEM-010",
    "HXC-SEM-016",
    "HXC-SEM-024",
    "HXC-MAC-002"
  ],
  "sources": [
    "scripts/test/c_fixture_harness.py",
    "test/enum_lowering/native/layout_consumer.c",
    "test/enum_lowering/native/layout_provider.c",
    "test/enum_lowering/native/layout_consumer.cpp",
    "test/enum_lowering/expected/program.h",
    "test/enum_lowering/expected/program.c",
    "test/enum_lowering/run.py"
  ],
  "runner": {
    "command": [
      "python3",
      "../../enum_lowering/run.py"
    ],
    "workingDirectory": "test/runtime/enum-lowering",
    "timeoutSeconds": 240,
    "network": false
  },
  "expected": {
    "exitCode": 0,
    "stdout": {
      "mode": "regex",
      "value": "strict C11 and C\\+\\+17 agreement, runtime-free production"
    },
    "artifacts": [
      {
        "path": "test/enum_lowering/expected/program.h",
        "format": "header",
        "comparison": "layout"
      },
      {
        "path": "test/enum_lowering/expected/program.c",
        "format": "c",
        "comparison": "exact"
      }
    ]
  }
}
