{
  "schemaVersion": 1,
  "id": "explicit-evaluation-order-snapshot",
  "role": "fixture",
  "type": "snapshot",
  "status": "active",
  "requirements": [
    "HXC-PROD-002",
    "HXC-COMP-003",
    "HXC-SEM-004"
  ],
  "sources": [
    "scripts/test/snapshots.py",
    "test/hxc_ir/expected/semantic.hxcir",
    "test/evaluation_order/expected/evaluation.hxcir",
    "test/evaluation_order/expected/program.h",
    "test/evaluation_order/expected/program.c",
    "test/evaluation_order/expected/symbols.json",
    "test/evaluation_order/run.py"
  ],
  "runner": {
    "command": [
      "python3",
      "../../../scripts/test/snapshots.py",
      "--check",
      "--suite",
      "evaluation-order"
    ],
    "workingDirectory": "test/snapshot/evaluation-order",
    "timeoutSeconds": 120,
    "network": false
  },
  "expected": {
    "exitCode": 0,
    "artifacts": [
      {
        "path": "test/evaluation_order/expected/evaluation.hxcir",
        "format": "hxcir",
        "comparison": "exact"
      },
      {
        "path": "test/evaluation_order/expected/program.h",
        "format": "header",
        "comparison": "exact"
      },
      {
        "path": "test/evaluation_order/expected/program.c",
        "format": "c",
        "comparison": "exact"
      },
      {
        "path": "test/evaluation_order/expected/symbols.json",
        "format": "json",
        "comparison": "semantic-json"
      }
    ]
  }
}
