{
  "schemaVersion": 1,
  "id": "generic-specialization-positive",
  "role": "fixture",
  "type": "positive",
  "status": "active",
  "requirements": ["HXC-SEM-007", "HXC-SEM-015", "HXC-SEM-016", "HXC-MAC-005"],
  "sources": [
    "scripts/test/compiler_discovery.py",
    "docs/specs/generic-specialization-report.schema.json",
    "src/reflaxe/c/lowering/CGenericSpecialization.hx",
    "src/reflaxe/c/lowering/CGenericSpecializationReport.hx",
    "test/generic_specialization/fixtures/abstract_owner/Main.hx",
    "test/generic_specialization/fixtures/closed_owner/Main.hx",
    "test/generic_specialization/fixtures/plain/Main.hx",
    "test/generic_specialization/fixtures/positive/Main.hx",
    "test/generic_specialization/run.py"
  ],
  "runner": {
    "command": ["python3", "../../generic_specialization/run.py"],
    "workingDirectory": "test/positive/generic-specialization",
    "timeoutSeconds": 600,
    "network": false
  },
  "expected": {
    "exitCode": 0,
    "stdout": {
      "mode": "regex",
      "value": "^generic-specialization: OK:"
    },
    "artifacts": [
      {
        "path": "test/generic_specialization/expected/hxc.specializations.json",
        "format": "json",
        "comparison": "semantic-json"
      }
    ]
  }
}
