{
  "schemaVersion": 1,
  "id": "direct-c-import-snapshot",
  "role": "fixture",
  "type": "snapshot",
  "status": "active",
  "requirements": [
    "HXC-FFI-001",
    "HXC-MAC-001",
    "HXC-MAC-003"
  ],
  "sources": [
    "scripts/test/snapshots.py",
    "test/c_import/expected/program.h",
    "test/c_import/expected/program.c",
    "test/c_import/expected/build.json",
    "test/c_import/expected/runtime-plan.json",
    "test/c_import/run.py"
  ],
  "runner": {
    "command": [
      "python3",
      "../../../scripts/test/snapshots.py",
      "--check",
      "--suite",
      "c-import"
    ],
    "workingDirectory": "test/snapshot/c-import",
    "timeoutSeconds": 120,
    "network": false
  },
  "expected": {
    "exitCode": 0,
    "artifacts": [
      {
        "path": "test/c_import/expected/program.h",
        "format": "header",
        "comparison": "exact"
      },
      {
        "path": "test/c_import/expected/program.c",
        "format": "c",
        "comparison": "exact"
      },
      {
        "path": "test/c_import/expected/build.json",
        "format": "json",
        "comparison": "semantic-json"
      },
      {
        "path": "test/c_import/expected/runtime-plan.json",
        "format": "json",
        "comparison": "semantic-json"
      }
    ]
  }
}
